{
  "schema_version": "q-demo.q2-request.v1",
  "session_ref": "sess-syn",
  "scene_id": "SCENE_SYN",
  "run_ids": [
    "RUN_X"
  ],
  "time": {
    "kind": "WALL",
    "wall_range": [
      "2026-11-01T13:00:00+08:00",
      "2026-11-01T13:00:21+08:00"
    ]
  },
  "seed": {
    "kind": "APPEARANCE",
    "class_label": "person",
    "color": {
      "label": "red",
      "min_verdict": "STRONG"
    }
  },
  "switch_mode": "AGENT_SEQUENTIAL",
  "parameter_set_id": "pset:q-demo:e08a0778ee3a08a5"
}
